{
  "startupDelaySeconds": 3,
  "settleMilliseconds": 300,
  "sequences": {
    "build-main-tabs-before-street-gear": [
      { "type": "capture", "name": "common" },
      { "type": "selectTab", "name": "Skills" },
      { "type": "waitFor", "label": "Free Knowledge Skill Points Remaining:" },
      { "type": "capture", "name": "skills" },
      { "type": "selectTab", "name": "Martial Arts" },
      { "type": "waitFor", "label": "Selected Martial Arts" },
      { "type": "capture", "name": "martial-arts" },
      { "type": "selectTab", "name": "Spells and Spirits", "optional": true },
      { "type": "waitFor", "label": "Selected Combat Spells" },
      { "type": "capture", "name": "spells-and-spirits" },
      { "type": "selectTab", "name": "Complex Forms and Sprites", "optional": true },
      { "type": "waitFor", "label": "Selected Advanced Complex Forms" },
      { "type": "capture", "name": "complex-forms-and-sprites" },
      { "type": "selectTab", "name": "Adept Powers", "optional": true },
      { "type": "waitFor", "label": "Power Points:" },
      { "type": "capture", "name": "adept-powers" },
      { "type": "selectTab", "name": "Critter Powers", "optional": true },
      { "type": "waitFor", "label": "Critter Powers" },
      { "type": "capture", "name": "critter-powers" },
      { "type": "selectTab", "name": "Cyberware and Bioware" },
      { "type": "waitFor", "label": "Selected Cyberware" },
      { "type": "capture", "name": "cyberware-and-bioware" }
    ],
    "career-main-tabs-before-street-gear": [
      { "type": "capture", "name": "common" },
      { "type": "selectTab", "name": "Skills" },
      { "type": "waitFor", "label": "Active Skills" },
      { "type": "capture", "name": "skills" },
      { "type": "selectTab", "name": "Martial Arts" },
      { "type": "waitFor", "label": "Selected Martial Arts" },
      { "type": "capture", "name": "martial-arts" },
      { "type": "selectTab", "name": "Spells and Spirits", "optional": true },
      { "type": "waitFor", "label": "Selected Combat Spells" },
      { "type": "capture", "name": "spells-and-spirits" },
      { "type": "selectTab", "name": "Complex Forms and Sprites", "optional": true },
      { "type": "waitFor", "label": "Selected Advanced Complex Forms" },
      { "type": "capture", "name": "complex-forms-and-sprites" },
      { "type": "selectTab", "name": "Adept Powers", "optional": true },
      { "type": "waitFor", "label": "Power Points:" },
      { "type": "capture", "name": "adept-powers" },
      { "type": "selectTab", "name": "Critter Powers", "optional": true },
      { "type": "waitFor", "label": "Critter Powers" },
      { "type": "capture", "name": "critter-powers" },
      { "type": "selectTab", "name": "Initiation", "optional": true },
      { "type": "waitFor", "label": "Initiate Grade:" },
      { "type": "capture", "name": "initiation" },
      { "type": "selectTab", "name": "Submersion", "optional": true },
      { "type": "waitFor", "label": "Submersion Grade:" },
      { "type": "capture", "name": "submersion" },
      { "type": "selectTab", "name": "Cyberware and Bioware" },
      { "type": "waitFor", "label": "Selected Cyberware" },
      { "type": "capture", "name": "cyberware-and-bioware" }
    ],
    "street-gear-tabs": [
      { "type": "selectTab", "name": "Street Gear" },
      { "type": "waitFor", "label": "Selected Lifestyles" },
      { "type": "capture", "name": "street-gear-lifestyle" },
      { "type": "selectTab", "name": "Armor" },
      { "type": "waitFor", "label": "Selected Armor" },
      { "type": "capture", "name": "street-gear-armor" },
      { "type": "selectTab", "name": "Weapons" },
      { "type": "waitFor", "label": "Selected Weapons" },
      { "type": "capture", "name": "street-gear-weapons" },
      { "type": "selectTab", "name": "Gear" },
      { "type": "waitFor", "label": "Selected Gear" },
      { "type": "capture", "name": "street-gear-gear" },
      { "type": "selectTab", "name": "Pets and Cohorts" },
      { "type": "waitFor", "label": "Add Pet" },
      { "type": "capture", "name": "street-gear-pets-and-cohorts" }
    ],
    "build-main-tabs-after-street-gear": [
      { "type": "selectTab", "name": "Vehicles & Drones" },
      { "type": "waitFor", "label": "Selected Vehicles" },
      { "type": "capture", "name": "vehicles-and-drones" },
      { "type": "selectTab", "name": "Character Info" },
      { "type": "waitFor", "label": "Description:" },
      { "type": "capture", "name": "character-info" },
      { "type": "selectTab", "name": "Other Info" },
      { "type": "waitFor", "label": "Physical Condition Track:" },
      { "type": "capture", "name": "right-other-info" }
    ],
    "career-main-tabs-after-street-gear": [
      { "type": "selectTab", "name": "Vehicles & Drones" },
      { "type": "waitFor", "label": "Selected Vehicles" },
      { "type": "capture", "name": "vehicles-and-drones" },
      { "type": "selectTab", "name": "Character Info" },
      { "type": "waitFor", "label": "Description:" },
      { "type": "capture", "name": "character-info" },
      { "type": "selectTab", "name": "Karma and Nuyen" },
      { "type": "waitFor", "label": "Karma Gained" },
      { "type": "capture", "name": "karma-and-nuyen" },
      { "type": "selectTab", "name": "Calendar" },
      { "type": "waitFor", "label": "Add Week" },
      { "type": "capture", "name": "calendar" },
      { "type": "selectTab", "name": "Notes" },
      { "type": "waitFor", "label": "Notes" },
      { "type": "capture", "name": "notes" },
      { "type": "selectTab", "name": "Improvements" },
      { "type": "waitFor", "label": "Selected Improvements" },
      { "type": "capture", "name": "improvements" },
      { "type": "selectTab", "name": "Condition Monitor" },
      { "type": "waitFor", "label": "Regain/Spend Edge" },
      { "type": "capture", "name": "right-condition-monitor" },
      { "type": "selectTab", "name": "Other Info" },
      { "type": "waitFor", "label": "Physical Condition Track:" },
      { "type": "capture", "name": "right-other-info" }
    ]
  },
  "buildActions": [
    { "type": "include", "name": "build-main-tabs-before-street-gear" },
    { "type": "include", "name": "street-gear-tabs" },
    { "type": "include", "name": "build-main-tabs-after-street-gear" }
  ],
  "careerActions": [
    { "type": "include", "name": "career-main-tabs-before-street-gear" },
    { "type": "include", "name": "street-gear-tabs" },
    { "type": "include", "name": "career-main-tabs-after-street-gear" }
  ],
  "characters": [
    { "path": "../fixtures/characters/Diego_v_alpha2_by_bessgeor.chum", "mode": "build" },
    { "path": "../fixtures/characters/Шпала - карьера.chum", "mode": "career" },
    { "path": "../fixtures/characters/facemage_Sam.chum", "mode": "build" },
    { "path": "../fixtures/characters/facemage_Sam_career.chum", "mode": "career" },
    { "path": "../fixtures/characters/rigger.chum", "mode": "build" },
    { "path": "../fixtures/characters/rigger_career.chum", "mode": "career" },
    { "path": "../fixtures/characters/hacker4boegspriet.chum", "mode": "build" },
    { "path": "../fixtures/characters/technotest.chum", "mode": "build" },
    { "path": "../fixtures/characters/technotest - career.chum", "mode": "career" },
    { "path": "../fixtures/characters/test_adept.chum", "mode": "career" },
    { "path": "../fixtures/characters/spirit.chum", "mode": "build" },
    { "path": "../fixtures/characters/Skull Carver - precareer.chum", "mode": "build" },
    { "path": "../fixtures/characters/Skull Carver - career.chum", "mode": "career" }
  ]
}
